{
    "url": "http://askjeeves.com",
    "ipaddress": "151.101.10.114",
    "uuid": "d7c93b59-265b-3d81-8724-414d79ce6ded",
    "date": "2019-04-28 07:24:23",
    "domain_whois": {
        "id": [
            "980411_DOMAIN_COM-VRSN"
        ],
        "status": [
            "clientDeleteProhibited https://icann.org/epp#clientDeleteProhibited",
            "clientTransferProhibited https://icann.org/epp#clientTransferProhibited",
            "clientUpdateProhibited https://icann.org/epp#clientUpdateProhibited"
        ],
        "creation_date": [
            "1995-11-29 05:00:00"
        ],
        "expiration_date": [
            "2019-11-28 05:00:00"
        ],
        "updated_date": [
            "2017-10-27 09:05:56"
        ],
        "registrar": [
            "MarkMonitor Inc."
        ],
        "whois_server": [
            "whois.markmonitor.com"
        ],
        "nameservers": [
            "DNS1.P03.NSONE.NET",
            "DNS2.P03.NSONE.NET",
            "DNS3.P03.NSONE.NET",
            "DNS4.P03.NSONE.NET"
        ],
        "emails": [
            "abusecomplaints@markmonitor.com"
        ],
        "contacts": {
            "registrant": null,
            "tech": null,
            "admin": null,
            "billing": null
        },
        "raw": [
            "   Domain Name: ASKJEEVES.COM\n   Registry Domain ID: 980411_DOMAIN_COM-VRSN\n   Registrar WHOIS Server: whois.markmonitor.com\n   Registrar URL: http://www.markmonitor.com\n   Updated Date: 2017-10-27T09:05:56Z\n   Creation Date: 1995-11-29T05:00:00Z\n   Registry Expiry Date: 2019-11-28T05:00:00Z\n   Registrar: MarkMonitor Inc.\n   Registrar IANA ID: 292\n   Registrar Abuse Contact Email: abusecomplaints@markmonitor.com\n   Registrar Abuse Contact Phone: +1.2083895740\n   Domain Status: clientDeleteProhibited https://icann.org/epp#clientDeleteProhibited\n   Domain Status: clientTransferProhibited https://icann.org/epp#clientTransferProhibited\n   Domain Status: clientUpdateProhibited https://icann.org/epp#clientUpdateProhibited\n   Name Server: DNS1.P03.NSONE.NET\n   Name Server: DNS2.P03.NSONE.NET\n   Name Server: DNS3.P03.NSONE.NET\n   Name Server: DNS4.P03.NSONE.NET\n   DNSSEC: unsigned\n   URL of the ICANN Whois Inaccuracy Complaint Form: https://www.icann.org/wicf/\n>>> Last update of whois database: 2019-04-28T07:24:25Z <<<\n\nFor more information on Whois status codes, please visit https://icann.org/epp\n\nNOTICE: The expiration date displayed in this record is the date the\nregistrar's sponsorship of the domain name registration in the registry is\ncurrently set to expire. This date does not necessarily reflect the expiration\ndate of the domain name registrant's agreement with the sponsoring\nregistrar.  Users may consult the sponsoring registrar's Whois database to\nview the registrar's reported date of expiration for this registration.\n\nTERMS OF USE: You are not authorized to access or query our Whois\ndatabase through the use of electronic processes that are high-volume and\nautomated except as reasonably necessary to register domain names or\nmodify existing registrations; the Data in VeriSign Global Registry\nServices' (\"VeriSign\") Whois database is provided by VeriSign for\ninformation purposes only, and to assist persons in obtaining information\nabout or related to a domain name registration record. VeriSign does not\nguarantee its accuracy. By submitting a Whois query, you agree to abide\nby the following terms of use: You agree that you may use this Data only\nfor lawful purposes and that under no circumstances will you use this Data\nto: (1) allow, enable, or otherwise support the transmission of mass\nunsolicited, commercial advertising or solicitations via e-mail, telephone,\nor facsimile; or (2) enable high volume, automated, electronic processes\nthat apply to VeriSign (or its computer systems). The compilation,\nrepackaging, dissemination or other use of this Data is expressly\nprohibited without the prior written consent of VeriSign. You agree not to\nuse electronic processes that are automated and high-volume to access or\nquery the Whois database except as reasonably necessary to register\ndomain names or modify existing registrations. VeriSign reserves the right\nto restrict your access to the Whois database in its sole discretion to ensure\noperational stability.  VeriSign may restrict or terminate your access to the\nWhois database for failure to abide by these terms of use. VeriSign\nreserves the right to modify these terms at any time.\n\nThe Registry database contains ONLY .COM, .NET, .EDU domains and\nRegistrars.\n"
        ]
    },
    "ip_whois": {
        "status": [
            "ALLOCATED UNSPECIFIED"
        ],
        "creation_date": [
            "2019-01-07 10:46:38",
            "1970-01-01 00:00:00"
        ],
        "updated_date": [
            "2019-01-07 10:46:38",
            "2001-09-22 09:31:27"
        ],
        "contacts": {
            "registrant": null,
            "tech": {
                "handle": "IANA1-RIPE"
            },
            "admin": {
                "handle": "IANA1-RIPE"
            },
            "billing": null
        },
        "raw": [
            "% This is the RIPE Database query service.\n% The objects are in RPSL format.\n%\n% The RIPE Database is subject to Terms and Conditions.\n% See http://www.ripe.net/db/support/db-terms-conditions.pdf\n\n% Note: this output has been filtered.\n%       To receive output for a database update, use the \"-B\" flag.\n\n% Information related to '151.101.0.0 - 151.105.255.255'\n\n% No abuse contact registered for 151.101.0.0 - 151.105.255.255\n\ninetnum:        151.101.0.0 - 151.105.255.255\nnetname:        NON-RIPE-NCC-MANAGED-ADDRESS-BLOCK\ndescr:          IPv4 address block not managed by the RIPE NCC\nremarks:        ------------------------------------------------------\nremarks:\nremarks:        For registration information,\nremarks:        you can consult the following sources:\nremarks:\nremarks:        IANA\nremarks:        http://www.iana.org/assignments/ipv4-address-space\nremarks:        http://www.iana.org/assignments/iana-ipv4-special-registry\nremarks:        http://www.iana.org/assignments/ipv4-recovered-address-space\nremarks:\nremarks:        AFRINIC (Africa)\nremarks:        http://www.afrinic.net/ whois.afrinic.net\nremarks:\nremarks:        APNIC (Asia Pacific)\nremarks:        http://www.apnic.net/ whois.apnic.net\nremarks:\nremarks:        ARIN (Northern America)\nremarks:        http://www.arin.net/ whois.arin.net\nremarks:\nremarks:        LACNIC (Latin America and the Carribean)\nremarks:        http://www.lacnic.net/ whois.lacnic.net\nremarks:\nremarks:        ------------------------------------------------------\ncountry:        EU # Country is really world wide\nadmin-c:        IANA1-RIPE\ntech-c:         IANA1-RIPE\nstatus:         ALLOCATED UNSPECIFIED\nmnt-by:         RIPE-NCC-HM-MNT\ncreated:        2019-01-07T10:46:38Z\nlast-modified:  2019-01-07T10:46:38Z\nsource:         RIPE\n\nrole:           Internet Assigned Numbers Authority\naddress:        see http://www.iana.org.\nadmin-c:        IANA1-RIPE\ntech-c:         IANA1-RIPE\nnic-hdl:        IANA1-RIPE\nremarks:        For more information on IANA services\nremarks:        go to IANA web site at http://www.iana.org.\nmnt-by:         RIPE-NCC-MNT\ncreated:        1970-01-01T00:00:00Z\nlast-modified:  2001-09-22T09:31:27Z\nsource:         RIPE # Filtered\n\n% This query was served by the RIPE Database Query Service version 1.93.2 (BLAARKOP)\n\n\n"
        ]
    },
    "http_headers": {
        "Server": "nginx",
        "Content-Type": "text/html; charset=utf-8",
        "X-App-Environment": "usw2",
        "X-XSS-Protection": "1",
        "X-Frame-Options": "DENY",
        "Content-Security-Policy": "frame-ancestors 'none';",
        "Set-Cookie": "user=\"o=1567&l=dir\"; Domain=.ask.com; Path=/",
        "Cache-control": "private",
        "Transfer-Encoding": "chunked",
        "Accept-Ranges": "bytes",
        "Date": "Sun, 28 Apr 2019 07:24:32 GMT",
        "Via": "1.1 varnish",
        "Connection": "close",
        "X-Served-By": "cache-mel19033-MEL",
        "X-Cache": "MISS",
        "X-Cache-Hits": "0",
        "X-Timer": "S1556436272.983337,VS0,VE273",
        "Vary": "Accept-Encoding"
    },
    "desktop": {
        "title": "Ask.com - What's Your Question?",
        "finalurl": "https://www.ask.com/?o=1567",
        "useragent": "user-agent=Mozilla/5.0 (Windows NT 10.0; Win64; x64) AppleWebKit/537.36 (KHTML, like Gecko) Chrome/72.0.3626.121 Safari/537.36",
        "screenshot": "d7c93b59-265b-3d81-8724-414d79ce6ded_d.png"
    },
    "mobile": {
        "title": "Ask.com - What's Your Question?",
        "finalurl": "https://www.ask.com/?o=1567",
        "useragent": "user-agent=Mozilla/5.0 (Linux; Android 8.0.0; SM-G965F Build/R16NW) AppleWebKit/537.36 (KHTML, like Gecko) Chrome/72.0.3626.121 Mobile Safari/537.36",
        "screenshot": "d7c93b59-265b-3d81-8724-414d79ce6ded_m.png"
    },
    "sslcertificate": {
        "countryName": "BE",
        "stateOrProvinceName": "California",
        "localityName": "San Francisco",
        "organizationName": "GlobalSign nv-sa",
        "commonName": "GlobalSign Organization Validation CA - SHA256 - G2"
    }
}